{
  "$schema": "https://json-schema.org/draft/2020-12/schema",
  "$id": "https://wazir.dev/schemas/clarification.schema.json",
  "title": "Clarification Artifact",
  "type": "object",
  "required": ["phase", "role", "run_id", "created_at", "sources", "status", "loop_number", "questions", "scope_summary"],
  "properties": {
    "phase": { "const": "clarify" },
    "role": { "const": "clarifier" },
    "run_id": { "type": "string", "minLength": 1 },
    "created_at": { "type": "string", "format": "date-time" },
    "sources": { "type": "array", "items": { "type": "string" } },
    "status": { "type": "string", "minLength": 1 },
    "loop_number": { "type": "integer", "minimum": 0 },
    "questions": { "type": "array", "items": { "type": "string" } },
    "scope_summary": { "type": "string", "minLength": 1 }
  },
  "additionalProperties": true
}
