{
  "phase": "clarify",
  "role": "clarifier",
  "run_id": "run-2026-03-11-example",
  "created_at": "2026-03-11T12:00:00Z",
  "sources": [
    "input/brief.md"
  ],
  "status": "complete",
  "loop_number": 0,
  "questions": [
    "Which host should be treated as the primary export target?"
  ],
  "scope_summary": "Verify canonical scaffolding and resolve structural drift in ordered batches."
}
